wav_filename,wav_filesize,transcript
wav/sample_0362.wav,285344,高质量发展是我们当前和今后一个时期 确定发展思路制定经济政策实施宏观调控的根本要求
wav/sample_0363.wav,103322,必须深刻认识全面领会真正落实
wav/sample_0364.wav,157606,习近平给各民主党派工商联和无党派人士提出三点希望
wav/sample_0365.wav,239788,一是希望大家深入学习领会中共十九大提出的重要思想重要观点重大判断重大举措
wav/sample_0366.wav,179016,引导广大成员增进对中国共产党和中国特色社会主义的政治认同
wav/sample_0367.wav,154292,把智慧和力量 凝聚到中共十九大确定的目标任务上来
wav/sample_0368.wav,210010,共同致力于新时代坚持和发展中国特色社会主义 实现中华民族伟大复兴
wav/sample_0369.wav,110518,二是希望大家充分发挥特点和优势
wav/sample_0370.wav,212600,在融入大局服务大局保障大局中 找准履职尽责的切入点和突破口
wav/sample_0371.wav,103340,深入进行调查研究提出真知灼见
wav/sample_0372.wav,108914,协助党委和政府做好矛盾化解工作
wav/sample_0373.wav,91072,积极营造团结稳定的社会环境
wav/sample_0374.wav,211314,三是希望各民主党派以换届为契机 继承和发扬多党合作的优良传统
wav/sample_0375.wav,187466,深化政治交接 加强思想组织制度 特别是领导班子建设
wav/sample_0376.wav,115696,提高中国特色社会主义参政党建设水平
wav/sample_0377.wav,185662,他还希望工商联加强自身建设做好代表人士教育培养工作
wav/sample_0378.wav,173422,中共中央政治局昨天召开的会议对明年的经济工作提出了多项要求
wav/sample_0379.wav,231258,比如要使宏观杠杆率得到有效控制 要加快住房制度改革 和长效机制建设等
wav/sample_0380.wav,138174,对于这些问题 专家向央广记者马闯做了部分解读
wav/sample_0381.wav,278168,在国家信息中心经济预测部宏观经济研究室主任牛离看来稳中求进是我们处理经济工作的一个方法论
wav/sample_0382.wav,174008,会议指出防范化解重大风险要使宏观杠杆率得到有效控制
wav/sample_0383.wav,82256,金融服务实体经济能力增强
wav/sample_0384.wav,105702,如何让防范风险工作取得积极成效
wav/sample_0385.wav,109310,国务院发展研究中心研究院张立群表示
wav/sample_0386.wav,92944,一方面 要稳定杠杆率增加的速度
wav/sample_0387.wav,94280,另一方面 就是要推动实体经济发展
wav/sample_0388.wav,163292,昨天的会上还提出 要加快住房制度改革和长效机制建设
wav/sample_0389.wav,135840,在篇幅不长的消息稿中 这十多个字最受大家关注
wav/sample_0390.wav,171022,去年此时 中央政治局会议便已经提出建立房地产长效机制
wav/sample_0391.wav,154834,牛离认为 在房价飙升已经严重影响百姓生活的情况下
wav/sample_0392.wav,62506,改革的步伐需要加快
wav/sample_0393.wav,191546,全国人大常委会委员长张德江昨天在人民大会堂会见了马尔代夫总统亚明
wav/sample_0394.wav,163560,按照两国元首的战略指引深入开展立法治国理政经验交流
wav/sample_0395.wav,282098,积极促进旅游教育青年等人文交流 为新时期中马关系实现更大发展 奠定法律和民意基础
wav/sample_0396.wav,229988,当天下午马尔代夫总统亚明前往北京天安门广场向人民英雄纪念碑敬献花圈
wav/sample_0397.wav,188158,国务院副总理张高丽昨天在北京会见了 国际能源署执行干事比罗尔
wav/sample_0398.wav,275974,张高丽表示 习近平总书记强调 中国将坚定不移贯彻创新协调绿色开放共享的发展理念
wav/sample_0399.wav,272172,重大清洁能源产业 推进能源生产和消费革命 构建清洁低碳安全高效的能源体系
wav/sample_0400.wav,236012,中国愿与国际能源署加强合作 共同推进中国能源绿色发展和能源国际合作
